{
  "schema_version": "evaluation-source@1",
  "source_version": "synthetic-representative-source@1",
  "source_id": "issue-4-synthetic-analogue",
  "provenance": {
    "origin": "project_synthetic",
    "redistribution": "committed_allowed",
    "license": "CC0-1.0",
    "contains_personal_data": false
  },
  "extraction_identity": {
    "archive_parser": "synthetic-fixture-builder@1",
    "xml_parser": "synthetic-fixture-builder@1",
    "extraction_rules": "epub-source-text@2",
    "publication_content_sha256": "64cdeb42f3469dbc5885fa208da113bfbbc1b1e0d66b81e0d566c8965eded87b",
    "extraction_sha256": "e6756ef5e2619e769f7033b961addaa79f5974283b21fac02e5e9832df8a13ec",
    "offset_unit": "unicode-scalar-value"
  },
  "passages": [
    {
      "source_ref": "source-ref-001",
      "locator": "spine[0000]::EPUB/synthetic.xhtml::/html[1]/body[1]/p[1]",
      "source_text": "The brass bell rang.The brass bell rang.",
      "source_text_sha256": "8f50bb80b126fb16c009c7109f04605ab766995d4745eae4edac2e938b1ee513"
    },
    {
      "source_ref": "source-ref-002",
      "locator": "spine[0000]::EPUB/synthetic.xhtml::/html[1]/body[1]/p[2]",
      "source_text": "The lantern blinked twice.",
      "source_text_sha256": "d908a137bc0bf42171c7bd92c57d8f26643db18a1c9161200138853484f56f9b"
    },
    {
      "source_ref": "source-ref-003",
      "locator": "spine[0000]::EPUB/synthetic.xhtml::/html[1]/body[1]/p[3]",
      "source_text": "The lantern blinked twice.",
      "source_text_sha256": "d908a137bc0bf42171c7bd92c57d8f26643db18a1c9161200138853484f56f9b"
    },
    {
      "source_ref": "source-ref-004",
      "locator": "spine[0000]::EPUB/synthetic.xhtml::/html[1]/body[1]/p[4]",
      "source_text": "Original synthetic benchmark line 005.",
      "source_text_sha256": "e770ba690f726b6bfc76942d4e294c23cc996e1d31867a5fefc38204d8abae54"
    },
    {
      "source_ref": "source-ref-005",
      "locator": "spine[0000]::EPUB/synthetic.xhtml::/html[1]/body[1]/p[5]",
      "source_text": "Original synthetic benchmark line 006.",
      "source_text_sha256": "5fb728f0b7f8ab7bc33fbd9d60fb8b4b3cd09c956da48c81de6fcd37d1055719"
    },
    {
      "source_ref": "source-ref-006",
      "locator": "spine[0000]::EPUB/synthetic.xhtml::/html[1]/body[1]/p[6]",
      "source_text": "Original synthetic benchmark line 007.",
      "source_text_sha256": "9172813d36369e8591edec05d5fa55a9f059b95237f453b77f24fd03090da83e"
    },
    {
      "source_ref": "source-ref-007",
      "locator": "spine[0000]::EPUB/synthetic.xhtml::/html[1]/body[1]/p[7]",
      "source_text": "Original synthetic benchmark line 008.",
      "source_text_sha256": "93d4681cb0f10a9d5f5cd398fe80feb609f046a2ec6d4473f76fa649fd1b1743"
    },
    {
      "source_ref": "source-ref-008",
      "locator": "spine[0000]::EPUB/synthetic.xhtml::/html[1]/body[1]/p[8]",
      "source_text": "Original synthetic benchmark line 009.",
      "source_text_sha256": "ad27564d79d0efd6ed2b0ac3a6447110ab7a4337e3ef7a9956fa440f1e590145"
    },
    {
      "source_ref": "source-ref-009",
      "locator": "spine[0000]::EPUB/synthetic.xhtml::/html[1]/body[1]/p[9]",
      "source_text": "Original synthetic benchmark line 010.",
      "source_text_sha256": "4fcb9331df45a31d33ddb5fc9f2182c2511ddae9d98b9b1c53af65707ae1aa28"
    },
    {
      "source_ref": "source-ref-010",
      "locator": "spine[0000]::EPUB/synthetic.xhtml::/html[1]/body[1]/p[10]",
      "source_text": "Original synthetic benchmark line 011.",
      "source_text_sha256": "3a3a6c2555e32b6dd8e51e7b8ff5dcadb0d4423769171a1820129cb34ea2d712"
    },
    {
      "source_ref": "source-ref-011",
      "locator": "spine[0000]::EPUB/synthetic.xhtml::/html[1]/body[1]/p[11]",
      "source_text": "Original synthetic benchmark line 012.",
      "source_text_sha256": "673d2e82e5b2f10748121679eae86995db35cb9b2bcee476773ba136a8c2dca1"
    },
    {
      "source_ref": "source-ref-012",
      "locator": "spine[0000]::EPUB/synthetic.xhtml::/html[1]/body[1]/p[12]",
      "source_text": "Original synthetic benchmark line 013.",
      "source_text_sha256": "b6d6357fd7a0e8b3bfcd05d6af5515bb396821684e91164500529edbdd931266"
    },
    {
      "source_ref": "source-ref-013",
      "locator": "spine[0000]::EPUB/synthetic.xhtml::/html[1]/body[1]/p[13]",
      "source_text": "Original synthetic benchmark line 014.",
      "source_text_sha256": "6a924d4130e0b4c91f2c8b50b6da00070bd19593b48c9eaaa27473244295bcba"
    },
    {
      "source_ref": "source-ref-014",
      "locator": "spine[0000]::EPUB/synthetic.xhtml::/html[1]/body[1]/p[14]",
      "source_text": "Original synthetic benchmark line 015.",
      "source_text_sha256": "8344366874f895fa6db8596b1796ca7bebcf3f0559d7ee89cb194a5c5ece314b"
    },
    {
      "source_ref": "source-ref-015",
      "locator": "spine[0000]::EPUB/synthetic.xhtml::/html[1]/body[1]/p[15]",
      "source_text": "Original synthetic benchmark line 016.",
      "source_text_sha256": "38887c01edc7d1fc9a120ac7f3d73c76d78daaa1693e16d7fff92ec77e9f7454"
    },
    {
      "source_ref": "source-ref-016",
      "locator": "spine[0000]::EPUB/synthetic.xhtml::/html[1]/body[1]/p[16]",
      "source_text": "Original synthetic benchmark line 017.",
      "source_text_sha256": "5be1d77e45a3ee0665dafeb378aac6c76f9078e00891bfd03970fda62b0e6787"
    },
    {
      "source_ref": "source-ref-017",
      "locator": "spine[0000]::EPUB/synthetic.xhtml::/html[1]/body[1]/p[17]",
      "source_text": "Original synthetic benchmark line 018.",
      "source_text_sha256": "750eb02e5aa467e93007d1e7e36a0e50295b665ca7297e50495df9927348eea3"
    },
    {
      "source_ref": "source-ref-018",
      "locator": "spine[0000]::EPUB/synthetic.xhtml::/html[1]/body[1]/p[18]",
      "source_text": "Original synthetic benchmark line 019.",
      "source_text_sha256": "a713b4cc42f4011bf4cc74bee28f1b9c16e2db9c65c4667f627aebcd715f7c38"
    },
    {
      "source_ref": "source-ref-019",
      "locator": "spine[0000]::EPUB/synthetic.xhtml::/html[1]/body[1]/p[19]",
      "source_text": "Original synthetic benchmark line 020.",
      "source_text_sha256": "588707e9d9b375bbc88b0c552616ff736b8042ea851b89f88cfb77856b38442d"
    },
    {
      "source_ref": "source-ref-020",
      "locator": "spine[0000]::EPUB/synthetic.xhtml::/html[1]/body[1]/p[20]",
      "source_text": "Original synthetic benchmark line 021.",
      "source_text_sha256": "599f3691ecf503f0639fe2827d0dc620c6082c4a40a13d5d64634e84876d4566"
    },
    {
      "source_ref": "source-ref-021",
      "locator": "spine[0000]::EPUB/synthetic.xhtml::/html[1]/body[1]/p[21]",
      "source_text": "Original synthetic benchmark line 022.",
      "source_text_sha256": "debad448d86829c8ba8eddf42dd1af140c272c88e9c0745432fcb859aeb6f128"
    },
    {
      "source_ref": "source-ref-022",
      "locator": "spine[0000]::EPUB/synthetic.xhtml::/html[1]/body[1]/p[22]",
      "source_text": "Original synthetic benchmark line 023.",
      "source_text_sha256": "83588c8c7a91d6ac67d5814940afb8996d6088a52dd46e602c6da0c2ed772bea"
    },
    {
      "source_ref": "source-ref-023",
      "locator": "spine[0000]::EPUB/synthetic.xhtml::/html[1]/body[1]/p[23]",
      "source_text": "Original synthetic benchmark line 024.",
      "source_text_sha256": "e274ab7f4e7c87c78c83948c68d5d0c5c0699d16136681130d107ec7a71d4031"
    },
    {
      "source_ref": "source-ref-024",
      "locator": "spine[0000]::EPUB/synthetic.xhtml::/html[1]/body[1]/p[24]",
      "source_text": "Original synthetic benchmark line 025.",
      "source_text_sha256": "8f5c7269c16e19b9fab25a11ab3b76d299b9528328581ce531883a627054d051"
    },
    {
      "source_ref": "source-ref-025",
      "locator": "spine[0000]::EPUB/synthetic.xhtml::/html[1]/body[1]/p[25]",
      "source_text": "Original synthetic benchmark line 026.",
      "source_text_sha256": "8885cdee820a161d00df346223321929dc2395fd486567dd98c1155558616183"
    },
    {
      "source_ref": "source-ref-026",
      "locator": "spine[0000]::EPUB/synthetic.xhtml::/html[1]/body[1]/p[26]",
      "source_text": "Original synthetic benchmark line 027.",
      "source_text_sha256": "2add57733bd1d0370924f0eb217ae7d6aeed9d38efaf876dae97a1961f1165e8"
    },
    {
      "source_ref": "source-ref-027",
      "locator": "spine[0000]::EPUB/synthetic.xhtml::/html[1]/body[1]/p[27]",
      "source_text": "Original synthetic benchmark line 028.",
      "source_text_sha256": "3e7ceacfe82f66db36e6aa6f46e9922d727c7eaa32d8d1d66807209b178356bc"
    },
    {
      "source_ref": "source-ref-028",
      "locator": "spine[0000]::EPUB/synthetic.xhtml::/html[1]/body[1]/p[28]",
      "source_text": "Original synthetic benchmark line 029.",
      "source_text_sha256": "3d23114253192030535e255060122a1ab70f9f7c2e3b1887acd9f826e8df4b96"
    },
    {
      "source_ref": "source-ref-029",
      "locator": "spine[0000]::EPUB/synthetic.xhtml::/html[1]/body[1]/p[29]",
      "source_text": "Original synthetic benchmark line 030.",
      "source_text_sha256": "8e14c65a853ba916b08a0e9b19686e46b764f2bd34d923dc628d083b68505573"
    },
    {
      "source_ref": "source-ref-030",
      "locator": "spine[0000]::EPUB/synthetic.xhtml::/html[1]/body[1]/p[30]",
      "source_text": "Original synthetic benchmark line 031.",
      "source_text_sha256": "f55c7724df65b276026b80d74d94ce5d6b473144b7106d4bcef7058eab8a2c48"
    },
    {
      "source_ref": "source-ref-031",
      "locator": "spine[0000]::EPUB/synthetic.xhtml::/html[1]/body[1]/p[31]",
      "source_text": "Original synthetic benchmark line 032.",
      "source_text_sha256": "ce7d2d892fd42b7c28102374408b98cb4e75e232b3abb840f6d5adf8e2dacf12"
    },
    {
      "source_ref": "source-ref-032",
      "locator": "spine[0000]::EPUB/synthetic.xhtml::/html[1]/body[1]/p[32]",
      "source_text": "Original synthetic benchmark line 033.",
      "source_text_sha256": "82e214e9d4d54e7411f53bfc9c9acd70895e1e97d7de2807f04d2f84297237a8"
    },
    {
      "source_ref": "source-ref-033",